{
  "provider": "prime_intellect",
  "model": "meta-llama/llama-3.1-70b-instruct",
  "model_version": "2024-09",
  "created_at": "2026-03-20T12:00:00Z",
  "temperature": 0.2,
  "prompt_template_id": "llm_claim_proposals/v1",
  "prompt_template_sha256": "aaaaaaaaaaaaaaaaaaaaaaaaaaaaaaaaaaaaaaaaaaaaaaaaaaaaaaaaaaaaaaaa",
  "input_artifact_sha256": {
    "metadata_json": "bbbbbbbbbbbbbbbbbbbbbbbbbbbbbbbbbbbbbbbbbbbbbbbbbbbbbbbbbbbbbbbb",
    "claims_json": "cccccccccccccccccccccccccccccccccccccccccccccccccccccccccccccccc",
    "suggested_claims_json": "dddddddddddddddddddddddddddddddddddddddddddddddddddddddddddddddd",
    "source_text": "eeeeeeeeeeeeeeeeeeeeeeeeeeeeeeeeeeeeeeeeeeeeeeeeeeeeeeeeeeeeeeee"
  },
  "prompt_tokens": 100,
  "completion_tokens": 50,
  "reviewer_decision": "pending"
}
